root@lamponubuntu2004-s-1vcpu-1gb-tor1-01:~# tcpdump -r 0001.pcap
reading from file 0001.pcap, link-type EN10MB (Ethernet)
03:04:06.993229 IP lamponubuntu2004-s-1vcpu-1gb-tor1-01.ssh > bras-base-toroon0628w-grc-51-142-112-222-33.dsl.bell.ca.63811: Flags [P.], seq 2172523313:2172523357, ack 1669130141, win 501, options [nop,nop,TS val 1700888829 ecr 2901456416], length 44
03:04:06.993352 IP lamponubuntu2004-s-1vcpu-1gb-tor1-01.ssh > bras-base-toroon0628w-grc-51-142-112-222-33.dsl.bell.ca.63811: Flags [P.], seq 44:152, ack 1, win 501, options [nop,nop,TS val 1700888829 ecr 2901456416], length 108
03:04:06.993475 IP lamponubuntu2004-s-1vcpu-1gb-tor1-01.ssh > bras-base-toroon0628w-grc-51-142-112-222-33.dsl.bell.ca.63811: Flags [P.], seq 152:188, ack 1, win 501, options [nop,nop,TS val 1700888829 ecr 2901456416], length 36